{
  "schema_version": 1,
  "exported_at": "2026-08-14T21:00:00+02:00",
  "exported_from": "pwa",
  "place_states": [
    {
      "place_id": "0198f23a-5e5e-7b31-a8be-8c99507a2138",
      "want_to_visit": true,
      "favorite": false,
      "personal_note": null,
      "updated_at": "2026-08-09T18:20:00+02:00",
      "deleted_at": null
    }
  ],
  "visits": [
    {
      "id": "0198f93b-618d-762f-a589-ccf375139dd9",
      "place_id": "0198f23a-5e5e-7b31-a8be-8c99507a2138",
      "visited_at": "2026-08-09",
      "rating": 5,
      "people": ["Jana", "Petr"],
      "note": "Výborná prohlídka.",
      "created_at": "2026-08-09T18:20:00+02:00",
      "updated_at": "2026-08-09T18:20:00+02:00",
      "deleted_at": null
    }
  ]
}
